id	title
p646	Probabilistic Simulation Predicts Human Performance on Viscous Fluid-Pouring Problem
p647	The Influence of Group Interaction on Creativity in Engineering Design
p648	Using Subgoal Learning and Self-Explanation to Improve Programming Education
p649	An Architectural Account of Variation in Problem Solving and Execution
p650	Children's Awareness of Authority to Change Rules in Various Social Contexts
p651	Outcome or Strategy? A Bayesian Model of Intelligence Attribution
p652	Not all overlaps are equal: Social affiliation and rare overlaps of preferences
p653	What does the crowd believe? A hierarchical approach to estimating subjective beliefs from empirical data
p654	Probability Prediction in Children with ASD
p655	Intermediate Judgments Inhibit Belief Updating: Zeno's Paradox in Decision Making
p656	Task-set Selection in Probabilistic Environments: a Model of Task-set Inference
p657	The Description-Experience Gap in Risky Choice Framing
p658	A Neural Dynamic Model Parses Object-Oriented Actions
p659	Examining Cardiac and Behavioral Responses in a Modality Dominance Task
p660	A scaleable spiking neural model of action planning
p661	Benefiting from Being Alike: Interindividual Skill Differences Predict Collective Benefit in Joint Object Control
p662	Intuitive iconicity for events and objects
p663	Object : substance :: event : process
p664	Countability in eventualities and beyond
p665	Thematic relations in different views of meaning
p666	Inductive Ethics: A Bottom-Up Taxonomy of the Moral Domain
p667	U-INVITE: Estimating Individual Semantic Networks from Fluency Data
p668	Grounded Distributional Semantics for Abstract Words
p669	Leveling the Field: Talking Levels in Cognitive Science
p670	From uh-oh to tomorrow: Predicting age of acquisition for early words across languages
p671	Dynamical systems modeling of the child--mother dyad: Causality between child-directed language complexity and language development
p672	Statistical Learning Ability Can Overcome the Negative Impact of Low Socioeconomic Status on Language Development
p673	More than Words: The Many Ways Extended Discourse Facilitates Word Learning
p674	Linguistic Signatures of Cognitive Processes during Writing
p675	Cohesive Features of Deep Text Comprehension Processes
p676	Construal level affects intuitive moral responses to narrative content
p677	The Permeability of Fictional Worlds
p678	Integrating identification and perception: A case study of familiar and unfamiliar face processing
p679	Exploring the Cost Function in Color Perception and Memory: An Information-Theoretic Model of Categorical Effects in Color Matching
p680	Modeling the Visual Word Form Area Using a Deep Convolutional Neural Network
p681	Inattentional Blindness in a Coupled Perceptual--Cognitive System
p682	Fractal Scaling and Implicit Bias: A Conceptual Replication of Correll (2008)
p683	A Nonlinear Dynamical Systems Theory Perspective on Dual-Processing Accounts of Decision-Making under Uncertainty
p684	Balancing Structural and Temporal Constraints in Multitasking Contexts
p685	Helping people make better decisions using optimal gamification
p686	Curiosity-Driven Development of Tool Use Precursors: a Computational Model
p687	Desirable difficulties in the development of active inquiry skills
p688	The Impact of Granularity on the Effectiveness of Students' Pedagogical Decisions
p689	Active control of study leads to improved episodic memory in children
p690	Decision-Making and Biases in Causal-Explanatory Reasoning
p691	Beyond Markov: Accounting for Independence Violations in Causal Reasoning
p692	What Causal Illusions Might Tell us About the Identification of Causes
p693	Answering Causal Queries about Singular Cases
p694	Physics
p695	Neuroanatomy
p696	Biology
p697	Chemistry
p698	Prediction Around Event Boundaries During Continuous Viewing of Naturalistic Activity
p699	The Effect of Action Priming on Childrens Event Memory
p700	Higher-Level Goals Structure Childrens Action Memory
p701	On the Acquisition of Goal Hierarchies: A Computational Model
p702	Conventionality, Relationality and Aptness in Figurative Language Processing
p703	Introducing Deliberate Metaphor Theory
p704	Modeling figurative communication
p705	Metaphor and the human creative potential
p706	Linguistic input is tuned to children's developmental level
p707	Active Overhearing: Development in Preschoolers' Skill at "Listening in" to Naturalistic Overheard Speech
p708	Lexical Complexity of Child-Directed and Overheard Speech: Implications for Learning
p709	The Influence of Language-specific Auditory Cues on the Learnability of Center-embedded Recursion
p710	Between versus Within-Language Differences in Linguistic Categorization
p711	A cross-linguistic investigation on the acquisition of complex numerals
p712	Chinese and English speakers' neural representations of word meaning offer a different picture of cross-language semantics than corpus and behavioral measures
p713	Context, but not proficiency, moderates the effects of metaphor framing: A case study in India
p714	Active Viewing in Toddlers Facilitates Visual Object Learning: An Egocentric Vision Approach
p715	A 3D shape inference model matches human visual object similarity judgments better than deep convolutional neural networks
p716	Adapting Deep Network Features to Capture Psychological Representations
p717	Variable Precision Models of Visual Working Memory
p718	Noisy Parameters in Risky Choice
p719	Working Memory Affects Attention to Loss Value and Loss Frequency in Decision-Making under Uncertainty
p720	The development of heuristics in children: Base-rate neglect and representativeness
p721	Adults' guesses on probabilistic tasks reveal incremental representativeness biases
p722	Prerequisites of Cumulative Culture in Laboratory Studies of Cultural Evolution
p723	Language Evolution as Cultural Evolution
p724	The Cultural Evolution of Linguistic Structure
p725	Literacy as Cognitive Change Emerging from Material Engagement
p726	Puzzles in the Evolution of Numerical Cognition
p727	Are Symptom Clusters Explanatory? A Study in Mental Disorders and Non-Causal Explanation
p728	Stable Causal Relationships are Better Causal Relationships
p729	The Plausible Impossible: Causal Constraints on Magical Reasoning
p730	Implicit measurement of motivated causal attribution
p731	Environmental Orientation Affects Emotional Expression Identification
p732	Emotional influences on time perception
p733	The Effect of Emotion and Induced Arousal on Numerical Processing
p734	Neurophysiological Effects of Negotiation Framing