id	title
p313	Effects of Analogical Processing: Evidence for Re-representation
p314	Historical Semantics of Risk
p315	Inuence of 3D images and 3D-printed objects on spatial reasoning
p316	Do Open Specifier Positions at Clause Edges Alleviate Working Memory Load?
p317	A Tale of Two Disasters: Biases in Risk Communication
p318	Children consider others' expected costs and rewards when deciding what to teach
p319	Modeling category learning using a dual-system approach: A simulation of Shepard, Hovalnd and Jenkins (1961) by COVIS
p320	The St. Petersburg Paradox: A Subjective Probability Solution
p321	Creative Interaction with Blocks and Robots
p322	Individual Differences in the Acquisition of Strategies in a Complex Task
p323	Connections between ACT-R's declarative memory system and Minerva2
p324	Feature Overlap in Action Sequence
p325	Using Statistics to Learn Words and Grammatical Categories:<span style="mso-spacerun:yes"> </span>How High Frequency Words Assist Language Acquisition
p326	Do gestures serve an interpersonal function?
p327	Predictors of lexical stability in an artificially learnt language
p328	Representations of Entropy and of the Relations Same and Different Early in Human Development
p329	Forming spatial habits in the wild: Examining stabilization in classroom seating arrangements
p330	Is human learning driven by Prediction Error?
p331	The role of higher order relational structure in relational category label extension
p332	A concurrent task facilitates, not impedes, the heel-to-toe standing balance in children: The case of a dual-task benefit
p333	Analogies and Graphics can lead to Illusions of Understanding
p334	A Neural Model of Context Dependent Decision Making in the Prefrontal Cortex
p335	Thermodynamics and Cognition: Towards a Lawful Explanation of the Mind
p336	Relation between bimanual coordination and whole-body balancing on a slackline
p337	Gesture reveals spatial analogies during complex relational reasoning
p338	Biased Attention to Spatial Dimensions Predicts Children's Spatial Word Acquisition
p339	On Constancy in Spatial Perception
p340	Language and relational reasoning: Evidence from Korean
p341	How do Distributions of Item Sizes Affect the Precision and Bias in Representing Summary Statistics?
p342	Moral Social Media: Heavy Facebook Users Accept Harsher Moral Criticism for Microaggressions
p343	Explanatory Value, Probability, and Abductive Inference
p344	Predictions with Uncertain Categorization: A Rational Model
p345	A test of two models of probability judgment: quantum versus noisy probability
p346	Do Simple Probability Judgments Rely on Integer Approximation?
p347	On the Evaluability of Effort: Influences of Single and Joint Evaluation on Judgments of Subjective Effort in Memorial, Motor, and Perceptual Domains
p348	Critical Features of Joint Actions that Signal Human Interaction
p349	How should autonomous vehicles behave in moral dilemmas? Human judgments reflect abstract moral principles
p350	Explanatory Biases in Social Categorization
p351	Free-form response vs. yes/no-question methodologies in the study of human reasoning
p352	Generalisable patterns of gesture distinguish semantic categories in communication without language
p353	Memory-based decision making: Examining the relative influence experimental and pre-experimental exposure.
p354	Extracting Human Face Similarity Judgments: Pairs or Triplets?
p355	An experimental study on the observation of facts in explanation reconstruction
p356	Intensional Probability Judgments and Inclusion Fallacies With Generics
p357	Relative influence of anchoring and centering biases in reconstructive memory
p358	Structure-sensitive Noise Inference: Comprehenders Expect Exchange Errors
p359	Centering and the meaning of conditionals
p360	Multiple Systems for Modal Cognition
p361	Investigating Rational Analogy in the Spirit of John Stuart Mill:<span style="mso-spacerun:yes"> </span>Bayesian Analysis of Confidence about Inferences across Aligned Simple Systems
p362	Mandarin-English Bilinguals Match Lexical-Tone Processing to the Language Context
p363	Making it Right: Can the Right-Hemisphere Compensate for Language Function in Patients with Left-Frontal Brain Tumors?
p364	No Effect of Verbal Labels for the Shapes on Type II Categorization Tasks
p365	A normative theory of visual working memory limitations
p366	The construction of function representations
p367	Exploring the Relationship between Adolescents'<span style="mso-spacerun:yes"> </span>Interest in Algebra and Procedural Declines
p368	Attractivity Weighting: Take-the-Best's Foolproof Sibling
p369	Better safe than sorry: Risky function exploitation through safe optimization
p370	Effect of Aging on Inhibitory Attentional Mechanisms
p371	Speech Perception Across the Lifespan: Using a Gaussian Mixture Model to Understand Changes in Cue Weighting Between Younger and Older Adults
p372	An action dynamics study of the onset of prediction
p373	Searching large hypothesis spaces by asking questions
p374	Feature-based Joint Planning and Norm Learning in Collaborative Games
p375	A perspective on all cognition? A study of everyday environments from the perspective of distributed cognition
p376	Coalescing the Vapors of Human Experience into a Viable and Meaningful Comprehension
p377	The effect of loss and gain expression in the riddle on insight problem solving
p378	Neural Resonance Theory: Entrainment to Missing Pulse Rhythms
p379	In the nick of time: Using temporal cues to examine ongoing event representations
p380	Parsing Selective Attention and Executive Function in Children
p381	Explanation-based discourse inferences support early word learning
p382	On the psychological reality of linguistic event structures
p383	Mindfulness meditation as attention control training: A dual-blind investigation
p384	How event endstates are conceptualized in adults and infants
p385	Sex Differences in Mental Rotation Performance: The Self-fulfilling Prophecy of Gender Stereotypes
p386	Does Experience with Physics Concepts Improve Mental Rotation Performance?
p387	But vs. Although under the microscope
p388	Prediction of Single-Trial Behavior using a Layered Dynamic Systems Model with Evolutionary Algorithm Updating
p389	Bifurcation analysis of a Gradient Symbolic Computation model of incremental processing
p390	Neural bases of semantic-memory deficits for events
p391	A cognitive model of online event segmentation
p392	Attentional Enhancement at Event Boundaries
p393	Are children flexible speakers?<span style="mso-spacerun:yes"> </span>Effects of typicality and listener needs in children's event descriptions
p394	The role of viewpoint in event segmentation
p395	Discourse Analysis as a Solution to Interpretive Problems in Cognitive Development Research
p396	Monitoring the Level of Attention by Posture Measurement and EEG
p397	Filling in the gaps: Event segmentation is robust to missing information
p398	The Effect of Varying Problem Contexts on Learning Probability Rules
p399	Beyond the 64 Squares: Does Chess Instruction Enhance Children's Academic and Cognitive Skills? A Meta-Analysis
p400	Handedness and Mathematics: Toward a More Comprehensive Model
p401	Unifying Conflicting Perspectives in Group Activities: Roles of Minority Individuals
p402	The Role of Similarity in Constructive Memory: Evidence from Tasks with Children and Adults
p403	Are There Hidden Costs to Teaching Mathematics with Incorrect Examples?
p404	Generating Predictions Non-consciously: Evidence from Invisible Motion with and without Obstacles
p405	On the Tragedy of Personnel Evaluation
p406	Measuring lay theories of parenting and child development
p407	Scarcity captures attention and induces neglect: Eyetracking and behavioral evidence
p408	Choosing Poorly: Reward-Induced Strategy Shifts in Estimating the Probabilities of Conjunctions and Disjunctions
p409	Audio-Visual Task Switching in Multisensory Environments
p410	The Influence of Reputation Concerns and Social Biases on Children's Sharing Behavior
p411	Attentional Resource Allocation in Multisensory Processing is Task-dependent
p412	What Were They Thinking? Diagnostic Coding of Conceptual Errors in a Mathematics Learning Software Data Archive
p413	Surprising blindness to conversational incoherence in both instant-messaging and face-to-face speech
p414	The impact of biased hypothesis generation on self-directed learning
p415	Salience versus prior knowledge - how do children learn rules?
p416	A Hierarchical Probabilistic Language-of-Thought Model of Human Visual Concept Learning
p417	A Dynamic Neural Field Model of Speech Cue Compensation
p418	Which Learning Algorithms Can Generalize Identity-Based Rules to Novel Inputs?
p419	Temporal event clustering in speech versus music
p420	Causal Representation in Foresight: Can We Improve Memory and Novel Understanding?
p421	Process of visual input does not decide the accuracy imitation performance
p422	Hysteresis in Processing of Perceptual Ambiguity on Three Different Timescales
p423	Effects of experience in a developmental model of reading
p424	He will try to learn it because he doesn't know it. Young children's understanding of learning based on their knowledge states
p425	Emotions in lay explanations of behavior
p426	Young children and adults integrate past expectations and current outcomes to reason about others' emotions
p427	Modeling Impairments in Lexical Development
p428	Predicting Decision in Human-Agent Negotiation using functional MRI
p429	Dissociable effects of cue validity on bias formation and reversal
p430	Individual differences in verbalization predict change detection performance: A new perspective on the language-thought debate
p431	Examining Search Processes in Low and High Creative Individuals with Random Walks
p432	Developmentally plausible learning of word categories from distributional statistics
p433	Simulating Developmental Changes in Noun Richness through<span style="mso-spacerun:yes"> </span>Performance-limited Distributional Analysis
p434	Sign languages reveal spatial mappings of valence and magnitude
p435	Emergence of Euclidean geometrical intuitions in hierarchical generative models
p436	Rapid emotion discrimination in the infant brain
p437	A neural network model of hierarchical category development
p438	Implicit Emotional Priming of Traumatic Events: The Effects of Semantic Level and Emotional Activation
p439	Using a smartphone game to promote transfer of skills in a real world environment
p440	Event comprehension and memory in the predictive brain
p441	TBD
p442	TBD
p443	TBD
p444	TBD
p445	TBD
p446	TBD
p447	Visual narratives and converging evidence
p448	Understanding the moment-to-moment processing of sequential narratives
p449	Visual vs. Linguistic Narratives in individuals with Autism
p450	Could any real person look as despondent as Charlie Brown?
p451	Degeneracy results in canalisation of language structure: A computational model of word learning
p452	A performance model for early word learning
p453	The Interaction of Memory and Attention in Novel Word Generalization: A Computational Investigation
p454	Allocation of attention during auditory word learning
p455	Asking and evaluating natural language questions
p456	A Framework for Evaluating Speech Representations
p457	Training prospective abilities through conversation about the extended self
p458	Processing Consequences of Onomatopoeic Iconicity in Spoken Language Comprehension
p459	Stop paying attention: the need for explicit stopping in inhibitory control
p460	Don't Blink! Evaluating Training Paradigms for Overcoming the Attentional Blink
p461	Can Musical Engagement Alleviate Age-Related Decline in Inhibitory Control?
p462	Effects of Auditory Input on a Spatial Serial Response Time Task
p463	Modeling Triage Decision Making
p464	Modeling sampling duration in decisions from experience
p465	Temporal Horizons and Decision-Making: A Big Data Approach
p466	Process Modeling of Qualitative Decision Under Uncertainty
p467	Coordinate to cooperate or compete: Abstract goals and joint intentions in social interaction
p468	Contextual Events and Their Role in a Two-Choice Joint Simon Task
p469	Using Violations of Fitts' Law to Communicate during Joint Action
p470	Quantifying Joint Activities using Cross-Recurrence Block Representation
p471	How people differ in syllogistic reasoning
p472	Inferring Individual Differences Between and Within Exemplar and Decision-Bound Models of Categorization
p473	Memory for exemplars in category learning
p474	Episodic memory as a prerequisite for online updates of model structure
p475	Strategic search in semantic memory
p476	Systems Factorial Analysis of Item and Associative Retrieval
p477	A Dream Model: Reactivation and Re-encoding Mechanisms for Sleep-dependent Memory Consolidation
p478	An Ecological Model of Memory and Inferences
p479	Event participants and linguistic arguments
p480	Can the High-Level Semantics of a Scene be Preserved in the Low-Level Visual Features of that Scene? A Study of Disorder and Naturalness
p481	A Comparative Evaluation of Approximate Probabilistic Simulation and Deep Neural Networks as Accounts of Human Physical Scene Understanding
p482	Visualizing Events: Simulating Meaning in Language
p483	Communicating generalizations about events
p484	Definitely maybe and possibly even probably: efficient communication of higher-order uncertainty
p485	How Does Generic Language Elicit Essentialist Beliefs?
p486	Extended Metaphors are Very Persuasive
p487	Compression and communication in the cultural evolution of linguistic structure
p488	Adaptive group coordination and role differentiation
p489	The emergence of conventions in real-time environments
p490	Effects of inductive biases in iterated learning and coordination
p491	Conflict-based regulation of control in language production
p492	Connectionist Semantic Systematicity in Language Production
p493	Testing the Tolerance Principle: Children form productive rules when it is more computationally efficient to do so
p494	Syntactic Flexibility in the Noun: Evidence from Picture Naming
p495	Reading experience shapes the mental timeline but not the mental number line
p496	Putting the "th" in Tenths: The Role of Labeling Decimals in Revealing Place Value Structure
p497	Does Chess Instruction Enhance Mathematical Ability in Children? A Three-Group Design to Control for Placebo Effects
p498	Improving with Practice: A Neural Model of Mathematical Development
p499	Weaving an ambiguous lexicon
p500	Deep linear neural networks: A theory of learning in the brain and mind
p501	Observing and influencing preferences in time
p502	An empirical investigation of the evolutionary and ontogenetic roots of trust
p503	Toxic beliefs
p504	Discarding causal misattributions with abstract causal knowledge
p505	Redefining negotiation problems to form creative agreements
p506	Generalization of within-category feature correlations
p507	Do additional features help or harm during category learning? An exploration of the curse of dimensionality in human learners
p508	Switch it up: Learning Categories via Feature Switching
p509	Variability in category learning: The Effect of Context Change and Item Variation on Knowledge Generalization
p510	Spatial Memory and Foraging: How Perfect Spatial Memory Improves Foraging Performance
p511	Spatial Interference and Individual Differences in Looking at Nothing for Verbal Memory
p512	Deciding to Remember: Memory Maintenance as a Markov Decision Process
p513	Measuring and modeling distraction by self-referential processing in a complex working memory span task
p514	TBD
p515	Putting the action back into infant cognition
p516	TBD
p517	TBD
p518	TBD
p519	TBD
p520	General Mechanisms Underlying Language and Spatial Cognitive Development
p521	The Pragmatics of Spatial Language
p522	Systematic feature variation underlies adults' and children's use of in and on
p523	Verbalizing navigation: Explicit and implicit concepts
p524	Grammatical Bracketing Determines Learning of Non-adjacent Dependencies
p525	Linguistic Priming and Learning Adjacent and Non-Adjacent Dependencies in Serial Reaction Time Tasks
p526	Analyzing distributional learning of phonemic categories in unsupervised deep neural networks
p527	Statistical Learning of Prosodic Patterns and Reversal of Perceptual Cues for Sentence Prominence
p528	Talking with tact: Polite language as a balance between informativity and kindness
p529	Distinguishing processing difficulties in inhibition, implicature, and negation
p530	A speed-accuracy trade-off in children's processing of scalar implicatures
p531	Learning biases may prevent lexicalization of pragmatic inferences: a case study combining iterated (Bayesian) learning and functional selection
p532	Two Potential Mechanisms Underlying the Link between Approximate Number Representations and Symbolic Math in Preschool Children
p533	A 6-month longitudinal study on numerical estimation in preschoolers
p534	Children learn non-exact number word meanings first
p535	Do Do Do, The The The: Interactivity and Articulatory Suppression in Mental Arithmetic
p536	Understanding "almost": Empirical and computational studies of near misses
p537	Perceived Momentum Influences Responsibility Judgments
p538	When are representations of causal events quantum versus classical?
p539	A model of conditional probability judgment
p540	Shakers and Maracas: Action-Based Categorisation Choices in Triads Are Influenced by Task Instructions
p541	There is more to gesture than meets the eye: Visual attention to gesture's referents cannot account for its facilitative effects during math instruction
p542	Temporal Expressions in Speech and Gesture
p543	Effects of Gesture on Analogical Problem Solving: When the Hands Lead you Astray
p544	Towards a Cognitively Realistic Representation of Word Associations
p545	From Words to Behaviour via Semantic Networks
p546	The Structure of Names in Memory: Deviations from Uniform Entropy Impair Memory for Linguistic Sequences
p547	N400 amplitudes reflect change in a probabilistic representation of meaning: Evidence from a connectionist model
p548	Simple trees in complex forests: Growing Take The Best by Approximate Bayesian Computation
p549	Cognitive Strategies in HCI and Their Implications on User Error
p550	Transfer of Cognitive Skills in Developmental Tasks
p551	Controlled vs. Automatic Processing: A Graph-Theoretic Approach to the Analysis of Serial vs. Parallel Processing in Neural Network Architectures
p552	Extraction of Event Roles From Visual Scenes is Rapid, Automatic, and Interacts with Higher-Level Visual Processing
p553	Learning Behavior-Grounded Event Segmentations
p554	Specificity at the basic level in event taxonomies: The case of Maniq verbs of ingestion
p555	Vector Space Semantic Models Predict Subjective Probability Judgments for Real-World Events
p556	Modeling developmental and linguistic relativity effects in color term acquisition
p557	A computational investigation of the Sapir-Whorf hypothesis: The case of spatial relations
p558	Do classifier categories affect or reflect object concepts?
p559	Left-right mental timeline is robust to visuospatial and verbal interference
p560	Cross-linguistic similarities aid third language learning in bilinguals
p561	Statistical learning bias predicts second-language reading efficiency
p562	L2 Idiom Processing: Figurative Attunement in Highly Idiomatic Contexts
p563	Learning Non-Adjacent Dependencies in Continuous Presentation of an Artificial Language
p564	Combining Multiple Perspectives in Language Production: A Probabilistic Model
p565	Conversational expectations account for apparent limits on theory of mind use
p566	Animal, dog, or dalmatian? Level of abstraction in nominal referring expressions
p567	Bayesian Pronoun Interpretation in Mandarin Chinese
p568	The Relationship Between the Numerical Distance Effect and Approximate Number System Acuity is Non-Linear
p569	An Information-Processing Account of Representation Change: International Mathematical Olympiad Problems are Hard not only for Humans
p570	Learning that numbers are the same, while learning that they are different
p571	Solving the knowledge-behavior gap: Numerical cognition explains age-related changes in fairness
p572	Varieties of experience: A new look at folk philosophy of mind
p573	Think Fast! Mental-state Language is Related to the Speed of False-belief Reasoning in Adulthood
p574	Recursive belief manipulation and second-order false-beliefs
p575	The Determinants of Knowability
p576	Boredom, Information-Seeking and Exploration
p577	The distorting effect of deciding to stop sampling
p578	When does passive learning improve the effectiveness of active learning?
p579	Measuring Interest in Science: The Science Curiosity Scale
p580	Introduction: Revisiting The Bridge Too Far
p581	Brain Substrates for Complex Learning
p582	Using Brain Reading to Understand Concept Learning in Educational Contexts
p583	Cortical Models of Brain Function
p584	Bridges from Brain Science to Reading: Some Key Ingredients of a Direct Translation
p585	How Can Brain Research Inform Academic Learning and Instruction?
p586	Discussant
p587	A Computational Model of Perceptual Deficits in Medial Temporal Lobe Amnesia
p588	Experience as a Free Parameter in the Cognitive Modeling of Language
p589	The mismeasurement of mind: How neuropsychological testing creates a false picture of cognitive aging
p590	A Bayesian Metric for Network Similarity
p591	tDCS to Premotor Cortex Changes Action Verb Understanding: Complementary Effects of Inhibitory and Excitatory Stimulation
p592	Sequential images are not universal, or Caveats for using visual narratives in experimental tasks
p593	First things first? Top-down influences on event apprehension
p594	Working memory encoding of events and their participants: a neural network model with applications in sensorimotor processing and sentence generation
p595	When the Words Don't Matter: Arbitrary labels improve categorical alignment through the anchoring of categories
p596	Learning in the wild - how labels influence what we learn
p597	The Sapir-Whorf Hypothesis and Probabilistic Inference: Evidence from the Domain of Color
p598	Which is in front of Chinese people: Past or Future? A study on Chinese people's space-time mapping
p599	How young children construct the lexicon as a connected system: The case of color names
p600	Early inexact meanings of number words
p601	The gradual development of childrens understanding of emotion labels<span style="mso-spacerun:yes"></span>
p602	Do children use biomechanical structure to constrain hypotheses about locomotion word meaning?<span style="mso-spacerun:yes"></span>
p603	Conceptual structure and the semantics of time words
p604	Examining Referential Uncertainty in Naturalistic Contexts from the Child's View: Evidence from an Eye-Tracking Study with Infants
p605	Tit-for-Tat: Effects of Feedback and Speaker Reliability on Listener Comprehension Effort
p606	What do you expect from an unfamiliar talker?
p607	Listener sensitivity to foreign-accented speech with grammatical errors
p608	When to Block versus Interleave Practice? Evidence Against Teaching Fraction Addition before Fraction Multiplication
p609	The Effects of Gender Stereotypes for Structure Mapping in Mathematics
p610	The Relational SNARC: Spatial Representation of Nonsymbolic Ratios?
p611	College Students' Understanding of Linear Functions: Slope is Slippery
p612	The Naive Utility Calculus unifies spatial and statistical routes to preference
p613	Know Your Enemy: Applying Cognitive Modeling in Security Domain
p614	Inferring priors in compositional cognitive models
p615	Is the Self-Concept like Other Concepts? The Causal Structure of Identity
p616	Natural science: Active learning in dynamic physical microworlds
p617	Information-Seeking, Learning and the Marginal Value Theorem: A Normative Approach to Adaptive Exploration
p618	On the Link between Fact Learning and General Cognitive Ability
p619	Facilitating Spatial Task Learning in Interactive Multimedia Environments While Accounting for Individual Differences and Task Difficulty
p620	Examining the specificity of the seductive allure effect
p621	From low to high cognition: A multi-level model of behavioral control in the primate brain
p622	Cognition without behaviour: Cognitive functions in behaviourally non-responsive individuals
p623	A Neural Field Model of Word Repetition Effects in Early Time-Course ERPs in Spoken Word Perception
p624	Welcoming Comments
p625	Let's see what happens: Dynamic events as foundational units of perception and cognition
p626	TBD
p627	TBD
p628	TBD
p629	TBD
p630	Simpler structure for more informative words: a longitudinal study
p631	Evolution of polysemous word senses from metaphorical mappings
p632	Synthesized size-sound sound-symbolism
p633	Deconstructing "tomorrow": How children learn the semantics of time
p634	The Contributions of Emerging Learning Systems to Implicit and Explicit Statistical Learning in Early Development
p635	A Single Paradigm for Implicit and Statistical Learning
p636	Toward a Unifying Framework for Implicit Learning and Statistical Learning<span style="mso-spacerun:yes"></span>
p637	Implicit Learning of Phonotactic Distributions in Language Production
p638	Language Evolution in the Lab: The Case of Child Learners
p639	Cultural Evolution Across Domains: Language, Technology and Art
p640	Cognitive biases and social coordination in the emergence of temporal language
p641	Alien species and alienable traits: An artificial language game investigating the spread of cultural variants between antagonistic groups
p642	What do we learn from rating metaphors?
p643	Performance Pressure and Comparison in Relational Category Learning
p644	Abstraction in time: Finding hierarchical linguistic structure in a model of relational processing
p645	The paradox of relational development: Could language learning be (temporarily) harmful?
