id	title
p1	Mothers' use of emotion words to their 15- to 18- month old children.
p2	Influencing Categorical Choices through Physical Object Interaction
p3	Conceptual Expansion During Divergent Thinking
p4	Shifting meanings: The fluidity of signal-meaning mappings in a minimal communicative task
p5	Statistical learning creates novel object associations via transitive relations
p6	Unsupervised learning of VerbNet argument structure
p7	Asymmetric derivational priming in recognition of Greek nouns and verbs
p8	Implicit versus explicit language learning: Differential effects of working memory and learning styles
p9	Sub-Categorical Properties of Stimuli Determine the Category-Order Effect
p10	Item Learning vs. High-Level Categorization in Consistent-Mapping Memory Search
p11	Choice adaptation to increasing and decreasing event probabilities
p12	Ambiguity and Representational Stability: What is the role of embodied experiences?
p13	Are Financial Advisors Money Doctors or Charlatans? Evidence on Trust, Advice, and Risk Taking in Delegated Asset Management
p14	Spatial Meaning is Retained in Emotion Metaphors: Some Evidence from Spanish
p15	The Neurorobotics Platform of the Human Brain Project
p16	Feature distinctiveness in verbs: links between verb distinctiveness, child directed speech and age of acquisition
p17	The role of emotional mediation in musical and vocal sound-color correspondence
p18	Moral language in the Basel Accords: A quantitative analysis
p19	Stereotype-Based Intuitions: A Psycholinguistic Approach to Experimental Philosophy's Sources Project'
p20	A Cognitively Realistic Model of Decision Making in Ocean Ecology
p21	Geometric representations of evidence in models of decision-making
p22	A connectionist model for automatic generation of child-adult interaction patterns
p23	Modeling N400 amplitude using vector space models of word representation
p24	Instance-based Learning in Multi-cue Diagnosis
p25	Rapid acquisition of novel information:<span style="mso-spacerun:yes"> </span>Is disjunctive syllogism necessary for fast mapping?
p26	Investigating the Effects of Transparency and Ambiguity on Idiom Learning
p27	Data Shows Human Behavior is Not Random, period.
p28	Taking the Easy Way Out: Effects of Feedback on Children's Metacognitive Control
p29	Numeric Competencies and Anchoring Biases
p30	Structural Alignment in Incidental Word Learning
p31	Information Search with Depleting and Non-Depleting Resources
p32	Do peer interactions influence infant communication development?
p33	Simple Search Algorithms on Semantic Networks Learned from Language Use
p34	Questions in informal teaching: A study of mother-child conversations
p35	Metaphor &amp; Emotion: Metaphorical Frames for Coping with Hardship
p36	Determining the alternatives for scalar implicature
p37	Spatializing emotion: A mapping of valence or magnitude?
p38	A Recurrent Network Approach to Modeling Linguistic Interaction
p39	Know Your Adversary: Insights for a Better Adversarial Behavioral Model
p40	Toward a Simulation Platform for Comparing Computational Cognitive Neuroscience Models
p41	Knowledge and use of price distributions by populations and individuals
p42	Children's understanding of effort and time
p43	Analyzing experimental paradigms under modification on web-based experiment platforms
p44	The Effects of Discourse Cues on Garden Path Processing
p45	Exploring Individual Differences in Preschooler's Causal Reasoning Skills in the Physical and Digital Domains
p46	Temporal Structure Modulates ERP Correlates of Visual Sequential Learning
p47	From computation to automization: How practice alters initial neural response to familiar arithmetic problems
p48	The role of regional topography in route planning
p49	Information Acquisition: Stopping Rules For Varying Levels of Probabilities and Consequences
p50	Hidden Markov Modeling of eye movements with image information leads to better discovery of regions of interest
p51	A Learned Label Modulates Object Representations in 10-Month-Old Infants
p52	A neurocomputational model of the effect of learned labels on infants' object representations
p53	Modeling language discrimination in infants using i-vector representations
p54	A Developmental Shift in the Relationship Between Sequential Learning, Executive Function, and Language Ability as Revealed by Event-Related Potentials
p55	An explicit theory of sortal representation and some evidence for it.
p56	Recursion in Nicaraguan Sign Language
p57	A Computational Exploration of Problem-Solving Strategies and Gaze Behaviors on the Block Design Task
p58	Dynamics of Strategy Adaptation in a Temporally Extended Monty Hall Dilemma
p59	Similarity-Based Reasoning is Shaped by Recent Learning Experience
p60	Semantic Contamination of Visual Similarity Judgments
p61	Memory for the Meaningless: Experts' Advantage at Recalling Unstructured Material
p62	Explaining December 4, 2015: Cognitive Science Ripped from the Headlines
p63	A computational theory of temporal inference
p64	Language does not explain the wine-specific memory advantage of wine experts
p65	Concept Membership vs Typicality in Sentence Verification Tasks
p66	Grammatical gender affects odor cognition
p67	Causal Reasoning in Infants and Adults: Revisiting backwards-blocking
p68	Ideal Composition of a Group for Maximal Knowledge Building in Crowdsourced Environments
p69	Under Pressure: How Time-Limited Cognition Explains Statistical Learning by 8-Month Old Infants
p70	Memory for the Random: A Simulation of Computer Program Recall
p71	Trump supported it?! A Bayesian source credibility model applied to appeals to specific American presidential candidates' opinions
p72	Collaborative Story Construction and Telling for Second Language Learning
p73	Infants' speech and gesture production in Mozambique and the Netherlands
p74	Influence of Need for Cognition and Cognitive Closure on Magic Perceptions
p75	ADHD modulates link between event processing and recall
p76	A Perception-Based Threshold for Bidirectional Texture Functions
p77	The Primary and Convergent Retrieval Model of Recall
p78	Modeling adaptation to a novel accent
p79	Where Should Researchers Look for Strategy Discoveries during the Acquisition of Complex Task Performance? The Case of Space Fortress
p80	Effects of categorization on item memory and forgetting
p81	The effect of "mood": Group-based collaborative problem solving by taking different perspectives
p82	Our morals really depends on our language: The foreign language effect within participants
p83	The Charon Model of Moral Judgment
p84	Is it a nine, or a six? Prosocial and selective perspective taking in four-year-olds
p85	The Illusion of Explanatory Depth in a Misunderstood Field: The IOED in Mental Disorders
p86	Semantic, Lexical, and Geographic Cues in Recall Processes
p87	Can Distributional Fitting of Short Semantic Fluency Results Predict ADHD?
p88	Language influences attention to Japanese event components in native English-speaking<span style="mso-spacerun:yes"> </span>21- to 24-month-olds
p89	A Preliminary Model of Situation Awareness in a Cognitive Architecture.
p90	Which Statistic Matters? Effects of Category Size and Distribution on Statistical Category Learning
p91	Cognitive Predictors of Timed and Untimed Early Arithmetic Performance
p92	Using Prior Data to Inform Model Parameters in the Predictive Performance Equation
p93	Feedback Markers in Mandarin: Tracking Cognitive Status in Conversation
p94	The Semantic Stroop Effect: An Ex-Gaussian Analysis
p95	Increasing preschoolers' awareness of lexical ignorance to encourage word-learning
p96	Preferring the Mighty to the Meek:<span style="mso-spacerun:yes"> </span>Toddlers prefer Superior to Subordinate Individuals.
p97	Informant effort expenditure impacts young children's learning, eye gaze, and trust
p98	No stereotype threat effect in international chess
p99	Exploring the Use of Conversations with Virtual Agents in Assessment Contexts
p100	Causality, Normality, and Sampling Propensity
p101	Does Contrast or Comparison Help More?<span style="mso-spacerun:yes"> </span>The Role of Learning Mode and Category Type
p102	Optimal Predictions in Illness Cognition
p103	Visual constraints modulate stereotypical predictability of agents during situated language comprehension
p104	Attentive and Pre-Attentive Processes in Multiple Object Tracking:<span style="mso-spacerun:yes"> </span>A Computational Investigation
p105	Trust, Communication, and Inequality
p106	From embodied metaphors to metaphoric gestures
p107	Blink durations reflect mind wandering during reading
p108	The effect of disfluency on mind wandering during text comprehension
p109	An Analysis of Frame Semantics of Continuous Processes
p110	Comparing predictions of lexical norm data obtained using word associations and word collocation
p111	Viewing time affects overspecification: Evidence for two strategies of attribute selection during reference production
p112	Disfluency production in speech and gesture
p113	Motor cortex excitability during processing of handwritten and typed non-action-related text
p114	The Effect of Book Design on Beginning Readers' Attention Allocation
p115	Individual Differences in Pupil Dilation during Naming Task
p116	Metaphor and Memory:<span style="mso-spacerun:yes"> </span>How Metaphors Instantiate Schemas in and Influence Memory of Narrative
p117	A rational speech-act model of projective content
p118	What Makes You Feel You Are Learning: Cues to Self-Regulated Learning
p119	Noticing causal properties of objects from sequence statistics
p120	Metaphorical Color Representations of Emotional Concepts in English and Chinese Speakers
p121	How the Physicality of Space Affects How We Think about Time
p122	Building bilingual semantic representations based on a corpus-based statistical learning algorithm
p123	The role of word-word co-occurrence in word learning
p124	Investigating Semantic Conflict between General Knowledge and Novel Information in Real-Time Sentence Processing
p125	Longitudinal L2 Development of the English Article in Individual Learners
p126	Consistency and credibility in legal reasoning: A Bayesian network approach
p127	Effects of the Plausibility of the Retracting Information on Memory Updating
p128	Translating testimonial claims into evidence for category-based induction
p129	Reduced benefit from regularities in language among Dyslexics
p130	The Combinatorial Power of Experience
p131	Can a Bayes' Net approach capture intuitive use of sequential testimonies in a legal reasoning paradigm?
p132	How Different Frames of Reference Interact:<span style="mso-spacerun:yes"> </span>A Neural Network Model
p133	Inferring Generic Meaning From Pragmatic Reference Failure
p134	Tangible models and haptic representations aid learning of molecular biology concepts
p135	Mental representations and processing of radical expressions
p136	Can Monaural Auditory Displays Convey Directional Information to Users?
p137	Improving Visual Memory with Auditory Input
p138	Intentionality and the Role of Labels in Categorization
p139	Relational discovery in category learning: interactions of learning strategy and task structure
p140	Plasticity of Categorization: Developmental Differences in Category Learning and Transfer between Children and Adults
p141	Learning Hierarchical Labels through Cross-situational Learning
p142	An Eye For Figurative Meaning: The Effects of Familiarity on Metaphor Comprehension
p143	A Twist On Event Processing: Reorganizing Attention To Cope With Novelty In Dynamic Activity Sequences
p144	Design from Zeroth Principles
p145	Exploring the Cognitive and Social Profile of Science Rejection
p146	Cognitive Sciences Strategies for Futures Studies (Foresight)
p147	Interaction of Instructional Material Order and Subgoal Labels on Learning in Programming
p148	Essays about service-learning events can be mined for program assessment
p149	Assessing Science Inquiry using MDP Goal Detectors
p150	Mechanisms for storing and accessing event representations in episodic memory, and their expression in language: a neural network model
p151	Lasting Political Attitude Change Induced by False Feedback About Own Survey Responses
p152	Using analogical comparison to help children learn the day-night cycle
p153	Representation: Problems and Solutions
p154	Memory biases in matching and recall: Evidence from initial consonant clusters
p155	Gender Differences in the Effect of Impatience on Men and Women's Timing Decisions
p156	A Robust Implementation of Episodic Memory for a Cognitive Architecture
p157	Children's Use of Orthographic Cues in Language Processing
p158	Information Processing during Intertemporal Choice: An Investigation using Eye Movement Data
p159	Analytical Thinking Predicts Less Teleological Reasoning and Religious Belief
p160	Using eye tracking data to compare models of numerical estimation
p161	A Cognitive Model of Fraction Arithmetic
p162	Verbs of Explanandum seem Crucial in Evaluating Explanations
p163	A Unified Framework for Bounded and Unbounded Numerical Estimation
p164	Biases and Benefits of Number Lines and Pie Charts in Proportion Representation
p165	Causal Contrasts Promote Algebra Problem Solving
p166	Factors Influencing Categorization Strategy in Visual Category Learning
p167	Unlikely Outcomes' Might Never Occur, But What About<span style="mso-spacerun:yes"> </span>Unlikely (20% Chance)' Outcomes?
p168	Kindergarteners and adults learn fraction-rules in a categorization task
p169	Solution of division by access to multiplication: Evidence from eye tracking
p170	Why Sense-Making through Magnitude May Be Harder for Fractions than for Whole Numbers
p171	The effect of language impairment on non-symbolic exact quantity representation
p172	Social Cues Modulate Cognitive Status of Discourse Referents
p173	The Variable Relationship Between On-Task Behavior and Learning
p174	When High WMC Promotes Mental Set: A Model of the Water Jar Task
p175	Mind reading: Discovering individual preferences from eye movements using switching hidden Markov models
p176	This problem has no solution: when closing one of two doors results in failure to access any.
p177	On Measuring the Difficulty of Scrabble-like Problems
p178	Developmental deficit in autobiographical episodic memory: Evidence from Williams syndrome
p179	Linear separability and human category learning: Revisiting a classic study
p180	Electrophysiological markers indicate disturbance of involuntary attention, but not voluntary attention, in adult ADHD patients
p181	An interactive model accounts for both ultra-rapid superordinate classification and basic-level advantage in object recognition
p182	Mind Wandering during Film Comprehension: The Role of Prior Knowledge and Situational Interest
p183	Embodiment Effects in Evolutionary Robotics
p184	Racial Essentialism is Associated With Prejudice Towards Blacks in 5- and 6-Year-Old White Children
p185	Referential choice in identification and route directions
p186	Adults' drawing and recognition of familiar objects and substances: Nonsolids are hard to identify
p187	The Development of Intuitions about the Controllability of Thoughts, Emotions, and Behavior
p188	Learning and making novel predictions about others' preferences
p189	Gibson's Reasons for Realism and Gibsonian Reasons for Anti-Realism: An Ecological Approach to Model-Based Reasoning in Science
p190	Differentiating between Encoding and Processing during Sequential Diagnostic Reasoning: An Eye tracking study.
p191	Using Nature Language Processing to Improve Optical Character Recognition
p192	Document Cohesion Flow: Striving towards Coherence
p193	Motion Capture of Phase Change Transitions During Insight Problem Solving
p194	Modeling the Contribution of Central Versus Peripheral Vision in Scene, Object, and Face Recognition
p195	Predictable stimulus onsets improve memory
p196	Investigating the Effect of Experience on Concrete and Abstract Word Processing
p197	The influence of temporal order on the recognition of causal relations
p198	Modular versus Integrated Causal Learning
p199	Analytic Eye Movement Patterns in Face Recognition are Associated with Better Performance and more Top-down Control of Visual Attention: an fMRI Study
p200	The Aging Lexicon: Differences in the Semantic Networks of Younger and Older Adults
p201	Your Obstacle on My Mind: Task Co-representation in Coordination is Modulated by External Timing Cues
p202	Modeling the Influence of Knowledge on Recognition: Connecting visual recognition behavior across development to PDP computational models of semantic knowledge
p203	Establish Trust and Express Attitude for a Non-Humanoid Robot
p204	Network Analysis of Characters' Relationship in "Chronicle of Death foretold" using Graph Theory
p205	Decision contamination in the wild:<span style="mso-spacerun:yes"> </span>Sequential dependencies in Yelp review ratings
p206	Integrating physical reasoning and visual object recognition for fully occluded scene interpretation
p207	Are we ON the same page? Monolingual and bilingual acquisition of familiar and novel relational language
p208	Monolinguals' and Bilinguals' Use of Language in Forming Novel Object Categories
p209	Context-dependent Processes and Engagement in Reading Literature
p210	The Impact of Interactivity on Simulation-Based Science Inquiry with Variable-Setting Controls
p211	The presence of meaning constrains productive language processes: A test of the language game hypothesis in type writing.
p212	Music Reading Expertise Modulates Visual Spans in both Music Note and English Letter Reading
p213	Measuring Cognitive Skills through Conversation-Based Assessment
p214	Making invisible "trouble" visible: Self-repair increases abstraction of referring expressions
p215	Visual Statistical Learning Deficits in Children with Developmental Dyslexia:<span style="mso-spacerun:yes"> </span>an Event Related Potential Study
p216	Benefits for Grounded Feedback over Correctness in a Fraction Addition Tutor
p217	Hindsight Bias in Wikipedia
p218	An Empirical Evaluation of Models for How People Learn Cue Search Orders
p219	Fuse to be used: A weak cue's guide to attracting attention
p220	The sequence of study changes what is encoded during category learning.
p221	Social Affordance Tracking over Time - A Sensorimotor Account of False-Belief Tasks
p222	Imagining activities: The role of perspective and grammatical aspect
p223	Modeling Commonsense Reasoning via Analogical Chaining: A Preliminary Report
p224	Comparing competing views of analogy making using eye-tracking technology
p225	Analogical Generalization and Retrieval for Denominal Verb Interpretation
p226	The Effects of Grammatical Aspect and Visual Perspective on Imaginging Accomplishments
p227	Single-kernel models of single-voxel visual selectivities in convolution neural networks
p228	The Relationship Between Mental-state Language and False-belief Understanding in Adulthood
p229	Concept of a Deity: Structure and Properties
p230	Causal Action: A Fundamental Constraint on Perception of Bodily Movements
p231	The face-space duality hypothesis: a computational model
p232	Causal Learning With Continuous Variables Over Time
p233	The Emergence of Linguistic Consciousness and the "hard problem"
p234	Temporal Causal Strength Learning with Multiple Causes
p235	Sentire Decision Making in a Mixed-Motive Game
p236	Causal perception is constrained by principles of Newtonian mechanics
p237	Towards a Pre-Newtonian Intuitive Physics of Object Collisions
p238	Syntax Accommodation in Social Media Conversations
p239	Pragmatic relativity: Gender and context affect the use of personal pronouns in discourse differentially across languages
p240	A Deep Siamese Neural Network Learns the Human-Perceived Similarity Structure of Facial Expressions Without Explicit Categories
p241	Language Informativity: Is starfish more of a fish in English than in Dutch?
p242	Measuring the Causal Dynamics of Facial Interaction with Convergent Cross Mapping
p243	Selecting Explanations from Causal Chains: Transitivity Intuitions Require Exportable Mechanisms
p244	Modelling the co-development of word learning and perspective-taking
p245	Inferring actions, intentions, and causal relations in a neural network
p246	Evaluating Causal Hypotheses: The Curious Case of Correlated Cues
p247	Linguistic niches emerge from pressures at multiple timescales
p248	Multimodal Dynamics of Explaining the Mechanisms of Global Warming
p249	Consequences of bilingualism for perceptions of categories and similarity
p250	Understanding human facial attractiveness from multiple views
p251	Reciprocal altruism in preschool-aged children
p252	Learning How To Throw Darts: The Effect Of Modeling Type And Reflection On Dart-Throwing Skills
p253	Technological Shaping of Verbal Working Memory: A Difference between Chinese Phonology-Based and Orthography-Based Typing
p254	Collective search on rugged landscapes: A cross-environmental analysis
p255	Three barriers to effective thought experiments, as revealed by a system that externalizes students' thinking
p256	Linguistic alignment with artificial entities in the context of second language acquisition
p257	Experience Representation of Artificial Cognitive System in Interaction with Real World
p258	Should moral decisions be different for human and artificial cognitive agents?
p259	Moral Judgments: Studying People with Helping Professions
p260	Partnering with Autonomous Vehicles
p261	Representing Sequence: The Influence of Timeline Axis and Direction on Causal Reasoning in Litigation Law
p262	Finding Clarity Amidst the Clutter: How Parents Name Objects
p263	The Role of the Prefrontal Cortex in Inductive Reasoning: An fNIRS Study
p264	Dual process theory of reasoning and recognition memory errors: Individual differences in a memory prose task
p265	Language acquisition as sparse foraging: mapping path-dependence in word acquisition
p266	On the adaptive nature of memory-based false belief
p267	Deconstructing the multi-dimensional Aha! experience
p268	The Influence of Religious Beliefs on False Memory of Fabricated Events
p269	Do Subliminal Hints Facilitate Sequential Planning When Solving a Spatial Insight Problem?
p270	Multimodal Object Recognition and Categorisation by Interactive Behaviours
p271	Heuristics in exploration: Distributional information is selectively used for active learning
p272	Curiosity and Its Influence on Children's Memory
p273	Measuring individual and developmental differences in children's sense of confidence
p274	Human Reinforcement Learning of Sequential Action
p275	Developmental Differences in Children's Statistical Learning Abilities
p276	Attention and the Development of Inductive Generalization: Evidence from Recognition Memory
p277	Pragmatic inference in definite and indefinite contexts
p278	Predicting Overprecision in Range Estimation
p279	Assessing children's reading comprehension by the component processes tasks
p280	Finger Gnosis Predicts Children's Numeracy, Despite Controlling for Visuo-Spatial Memory
p281	Infants' Developing Coordinated Visual-Manual Object Exploration and Links with Vocabulary Development
p282	Influences of Speaker-Listener Similarity on Shadowing and Comprehension
p283	Expressive faces are remembered with less pictorial fidelity than neutral faces
p284	What Determines Human Certainty?
p285	Time Course of Fidelity and Contributing Factors to Long-Term Memory
p286	Reflexive Spatial Attention to Goal Directed Reaching
p287	Comparing Predictive and Co-occurrence Based Models of Lexical Semantics Trained on Child-directed Speech
p288	Who should I tell? Young children correct and maintain others' beliefs about the self
p289	Exploring the Neural Mechanisms Supporting Structured Sequence Processing and Language Using Event-Related Potentials: Some Preliminary Findings
p290	A subject-object asymmetry in the online processing of 'only': evidence from eye-tracking
p291	The Relationship Between Inhibitory Control and Free Will Beliefs in 4-to 6-Year-Old-Children
p292	Distributed Cognition in the Past Progressive: Narratives as Representational Tools for Clinical Reasoning
p293	Using determiners as contextual cues in sentence comprehension:<span style="mso-spacerun:yes"> </span>A comparison between younger and older adults
p294	A shape-heavy vocabulary does not a shape bias make:<span style="mso-spacerun:yes"> </span>A comparison of the content of English-learning children's and Spanish-learning children's typical vocabularies
p295	Verifying who "jumped more" or "higher" in simple events
p296	The use of dispositional cues to causality in judgements of mechanical and living interactions
p297	The comprehension of English Garden-path sentences by Mandarin and Korean learners of English as a second language
p298	Lexicalization Typology of Realization Events in Mandarin Chinese
p299	Extending the Talmyan Typology: A Macro-event as Event Integration and Grammaticalization
p300	Discriminability of sound contrasts in the face of speaker variation quantified
p301	Auditory N1 Amplitude Varies Across Multiple Acoustic and Phonological Dimensions in Speech
p302	How Spatial Ability and Stress Impact Escape Path
p303	Effects of Working Memory Training on L2 Proficiency and<span style="mso-spacerun:yes"> </span>Working Memory Capacity
p304	Does GIScience Training Enhance Spatial Navigation Ability?
p305	Human-object interaction understanding without objects
p306	Singular Interpretations Linger During the Processing of Plural Noun Phrases
p307	Using Motor Dynamics to Explore Real-time Competition in Cross-situational Word Learning: Evidence From Two Novel Paradigms
p308	Spatial Attention to Social Cues is not a Monolithic Process
p309	The ON/IN scale of semantic extensions of adpositions: testing through artificial language learning
p310	Perception of math and non-math content in children's storybooks
p311	Modifying Cognitive Load Component Survey for K-12 STEM Testing
p312	Current Research in Cognitive Science at Educational Testing Service (ETS)
